{
  "$schema": "https://agent-project-os.org/schemas/project-registry-v1.schema.json",
  "created_at": "2026-08-18T00:00:00Z",
  "organization_id": "synthetic-commerce",
  "projects": [
    {
      "consumes": [], "depends_on": [], "lifecycle": "active", "owner": "human:example",
      "path": "projects/contracts", "priority": "P0", "project_id": "contracts",
      "provides": ["orders@2"], "repository": "https://example.invalid/contracts.git",
      "supervision": {"cadence": "weekly", "next_due_at": "2026-08-25T01:00:00Z", "timezone": "UTC"},
      "verification": ["python -m unittest"]
    },
    {
      "consumes": ["orders@2"], "depends_on": ["contracts"], "lifecycle": "active", "owner": "human:example",
      "path": "projects/service", "priority": "P1", "project_id": "service",
      "provides": ["service-api@2"], "repository": "https://example.invalid/service.git",
      "supervision": {"cadence": "weekly", "next_due_at": "2026-08-25T01:00:00Z", "timezone": "UTC"},
      "verification": ["node --test"]
    },
    {
      "consumes": ["service-api@2"], "depends_on": ["service"], "lifecycle": "active", "owner": "human:example",
      "path": "projects/client", "priority": "P2", "project_id": "client",
      "provides": [], "repository": "https://example.invalid/client.git",
      "supervision": {"cadence": "weekly", "next_due_at": "2026-08-18T01:00:00Z", "timezone": "UTC"},
      "verification": ["cargo test"]
    }
  ],
  "protocol_version": "1.0",
  "updated_at": "2026-08-18T00:00:00Z"
}
