{
  "$schema": "https://agent-project-os.org/schemas/project-registry-v1.schema.json",
  "created_at": "2026-08-18T08:00:00Z",
  "organization_id": "agent-project-os-lab",
  "projects": [
    {
      "consumes": [],
      "depends_on": [],
      "lifecycle": "active",
      "owner": "human:maintainer",
      "path": ".",
      "priority": "P1",
      "project_id": "agent-project-os",
      "provides": [
        "agent-project-os-protocol@1"
      ],
      "repository": "https://github.com/Jinchengawu/Agent-Project-OS.git",
      "supervision": {
        "cadence": "weekly",
        "next_due_at": "2026-08-25T01:00:00Z",
        "timezone": "Asia/Shanghai"
      },
      "verification": [
        ".venv/bin/python scripts/release_gate.py"
      ]
    }
  ],
  "protocol_version": "1.0",
  "updated_at": "2026-08-18T08:00:00Z"
}
